{
  "$schema": "./schema.json",
  "title": "Star Sizes",
  "unit": { "name": "AU", "km": 149597870.7 },
  "root": {
    "icon": "sun",
    "label": "Sun",
    "size": 0.0093,
    "features": [
      {
        "shape": "circle",
        "label": { "value": "Sun", "position": "center" },
        "fill": { "color": "#fff2d1", "opacity": 0.75 },
        "outline": { "color": "rgba(0,0,0,0.25)" }
      }
    ],
    "sizePresets": [
      { "label": "100 m", "km": 0.1 },
      { "label": "1 km", "km": 1, "default": true },
      { "label": "5 km", "km": 5 }
    ]
  },
  "models": [
    {
      "label": "Stars",
      "bearing": 90,
      "bearingControl": true,
      "models": [
        {
          "label": "Vega (α Lyrae)",
          "icon": "star",
          "size": 0.02197,
          "features": [
            {
              "shape": "circle",
              "label": { "value": "Vega", "position": "center" },
              "fill": { "color": "#b9c9ff", "opacity": 0.75 },
              "outline": { "color": "rgba(0,0,0,0.25)" },
              "offset": 0.0156345836
            }
          ]
        },
        {
          "label": "Deneb (α Cygni)",
          "icon": "star",
          "size": 1.88985,
          "features": [
            {
              "shape": "circle",
              "label": { "value": "Deneb", "position": "center" },
              "fill": { "color": "#c7d6ff", "opacity": 0.75 },
              "outline": { "color": "rgba(0,0,0,0.25)" },
              "offset": 0.9715430972
            }
          ]
        },
        {
          "label": "Antares A (α Scorpii)",
          "icon": "star",
          "size": 6.33053,
          "features": [
            {
              "shape": "circle",
              "label": { "value": "Antares A", "position": "center" },
              "fill": { "color": "#ffca8a", "opacity": 0.75 },
              "outline": { "color": "rgba(0,0,0,0.25)" },
              "offset": 5.0817314972
            }
          ]
        },
        {
          "label": "Betelgeuse (α Orionis)",
          "icon": "star",
          "size": 7.11253,
          "features": [
            {
              "shape": "circle",
              "label": { "value": "Betelgeuse", "position": "center" },
              "fill": { "color": "#ffca8a", "opacity": 0.75 },
              "outline": { "color": "rgba(0,0,0,0.25)" },
              "offset": 11.8032626972
            }
          ]
        },
        {
          "label": "V602 Carinae",
          "icon": "star",
          "size": 9.77508,
          "features": [
            {
              "shape": "circle",
              "label": { "value": "V602 Carinae", "position": "center" },
              "fill": { "color": "#ffbb7b", "opacity": 0.75 },
              "outline": { "color": "rgba(0,0,0,0.25)" },
              "offset": 20.2470698972
            }
          ]
        },
        {
          "label": "VY Canis Majoris",
          "icon": "star",
          "size": 13.21963,
          "features": [
            {
              "shape": "circle",
              "label": { "value": "VY Canis Majoris", "position": "center" },
              "fill": { "color": "#ffbb7b", "opacity": 0.75 },
              "outline": { "color": "rgba(0,0,0,0.25)" },
              "offset": 31.7444258972
            }
          ]
        }
      ]
    }
  ]
}
