{
  "$schema": "./schema.json",
  "title": "Demo",
  "unit": { "name": "km", "km": 1 },
  "root": {
    "label": "Root",
    "size": 2,
    "features": [
      {
        "shape": "circle",
        "outline": { "color": "green" },
        "label": { "position": "outline", "value": "Circle" }
      },
      {
        "shape": "circle",
        "radiusRatio": 0.01,
        "fill": { "color": "green" },
        "label": { "position": "outline", "value": "Circle" }
      }
    ],
    "sizePresets": [
      { "label": "1 km", "km": 1 },
      { "label": "10 km", "km": 10, "default": true },
      { "label": "300 km", "km": 300 }
    ]
  },
  "models": [
    {
      "label": "Group 1",
      "offset": 1,
      "bearing": 180,
      "models": [
        {
          "label": "Model 1",
          "size": 2,
          "features": [
            {
              "shape": "circle",
              "outline": { "color": "red" },
              "offset": 1,
              "bearing": 180
            }
          ]
        }
      ]
    }
  ]
}
